{"blocks":[{"attempt_index":7,"common_offset":0,"condition":"independent_stress","config_sha256":"ac440fdc24af8dafd72c1beffe83dd3d65b2dfd3f34308f9d41d5d437fb15bf6","device_id":"w7-p000-d00","enrollment_id":"w7-p000-d00-enroll-v1","experiment_id":"week7-majority3-auth-correlated-v1","noise_identity":{"attempt_id":7,"device_id":"w7-p000-d00","master_seed":2026101207,"model_version":"puf-snn-correlated-noise-v1","noise_domain_id":"week7-majority3-auth-correlated-v1:independent_stress","population_id":"w7-p000"},"policy_order":["majority-3-v1","single-read-v1"],"population_id":"w7-p000","reading_seed_sha256":["be9621ed01231d22df427faa5067518f4c9a26643a1da640bcc4317f5867931b","bb91f0cfddd25950cba6ff08be31d7888bfe45ae8665a7580b7ca33dcddf2502","945cbe5bd5457ca52c521dc2bee1d1042e48b3814ec3d4801826e7021a3e8525"],"rho":0.0,"session_seed_sha256":"37028e738c3f6d3980b8f4cc007acb39e88093ecdc1749f2936dfe178d4c30c0","sigma":0.25,"trial_id":"b71508bb614f8f306360d28ec41ef9a89f55ae880995d85d1a9e0f0cafbf2af5"},{"attempt_index":4,"common_offset":-1,"condition":"common_control","config_sha256":"ac440fdc24af8dafd72c1beffe83dd3d65b2dfd3f34308f9d41d5d437fb15bf6","device_id":"w7-p000-d00","enrollment_id":"w7-p000-d00-enroll-v1","experiment_id":"week7-majority3-auth-correlated-v1","noise_identity":{"attempt_id":4,"device_id":"w7-p000-d00","master_seed":2026101207,"model_version":"puf-snn-correlated-noise-v1","noise_domain_id":"week7-majority3-auth-correlated-v1:independent_nominal","population_id":"w7-p000"},"policy_order":["single-read-v1","majority-3-v1"],"population_id":"w7-p000","reading_seed_sha256":["2af23e74492ec4a96030201093f4f8236105294622adb7413b8adb40a74958ed","ac78b9d23b6ba7b84cfb08de20ef0e8c1075f80ef410531839810e13d9d1edb2","9594994cfc8dc76ad5ef1d09a60e7aeab06f598fbd7ab6483f9a520fe021a0c7"],"rho":0.0,"session_seed_sha256":"75f0d5ee5c0121425989556d6d0292fe7b36801b872c28972ede1765b5d1bf66","sigma":0.1,"trial_id":"d8e784ea0448de00ce08abe5b3a36b74f22e073c90dbd157ce50f2f9225e5aee"},{"attempt_index":1,"common_offset":0,"condition":"independent_nominal","config_sha256":"ac440fdc24af8dafd72c1beffe83dd3d65b2dfd3f34308f9d41d5d437fb15bf6","device_id":"w7-p000-d00","enrollment_id":"w7-p000-d00-enroll-v1","experiment_id":"week7-majority3-auth-correlated-v1","noise_identity":{"attempt_id":1,"device_id":"w7-p000-d00","master_seed":2026101207,"model_version":"puf-snn-correlated-noise-v1","noise_domain_id":"week7-majority3-auth-correlated-v1:independent_nominal","population_id":"w7-p000"},"policy_order":["majority-3-v1","single-read-v1"],"population_id":"w7-p000","reading_seed_sha256":["d41ad65fcb5af9647718f1c687bd4a59ec00fd97da866d5f8fad90cdaa74e802","31baaae725d8bf5c536f99a8db740c690fd06d0bbdcd333036ade3bff87a1ca9","bbd88f0e0d365c42fdcb2daa313cf43a32d5307ae89432b445641347f6be4b56"],"rho":0.0,"session_seed_sha256":"d02524eb273cf6b3781abaf862ac00d2804cf183d5174880336c994fcc52c293","sigma":0.1,"trial_id":"ed3ba71856250176c4c624a21b95afb8f33f73fd01fef833befc5c5cec00bf1a"},{"attempt_index":6,"common_offset":0,"condition":"independent_nominal","config_sha256":"ac440fdc24af8dafd72c1beffe83dd3d65b2dfd3f34308f9d41d5d437fb15bf6","device_id":"w7-p000-d00","enrollment_id":"w7-p000-d00-enroll-v1","experiment_id":"week7-majority3-auth-correlated-v1","noise_identity":{"attempt_id":6,"device_id":"w7-p000-d00","master_seed":2026101207,"model_version":"puf-snn-correlated-noise-v1","noise_domain_id":"week7-majority3-auth-correlated-v1:independent_nominal","population_id":"w7-p000"},"policy_order":["single-read-v1","majority-3-v1"],"population_id":"w7-p000","reading_seed_sha256":["14ce3db97b0ff9294ec056c49651d32f42322c470c756d8d4f360816e5c25cc5","060e7dfecc6c38f2bf7968139708384f200c78bf1009b1971c1e619c2a43e1e1","e6cfe9b789b4cb17d8cfd64d05c5974b7a9f1fbdec57bdf4f297f46e1e8dcd80"],"rho":0.0,"session_seed_sha256":"b48e05d6beec58df4ea96e936a1134ae3c6550909cebe5f3a3c329e7e80c5c39","sigma":0.1,"trial_id":"2f693931b6d2b70896d7a041d5e7ce7a5ce5f52b3c16e84bc1db090cf8f3d771"},{"attempt_index":4,"common_offset":0,"condition":"differential_rho50","config_sha256":"ac440fdc24af8dafd72c1beffe83dd3d65b2dfd3f34308f9d41d5d437fb15bf6","device_id":"w7-p000-d00","enrollment_id":"w7-p000-d00-enroll-v1","experiment_id":"week7-majority3-auth-correlated-v1","noise_identity":{"attempt_id":4,"device_id":"w7-p000-d00","master_seed":2026101207,"model_version":"puf-snn-correlated-noise-v1","noise_domain_id":"week7-majority3-auth-correlated-v1:differential_rho50","population_id":"w7-p000"},"policy_order":["single-read-v1","majority-3-v1"],"population_id":"w7-p000","reading_seed_sha256":["61dabc5693e04c436c29daf3628b95fbbbfaf4dc8c4397906f5fd65dd29e30a2","b0a3023151176a0b3a2c12c449bb0dffac94bf1ceac83778c9e99c8c38193e44","10f4c5ab3baebebf1c3d4f5093cd987b21a6d1398a92026afd969aa54636dd97"],"rho":0.5,"session_seed_sha256":"d2e71df76c82d2f866000ae75e2fa1806bc512dced13c1742c2d386408a9c1d5","sigma":0.1,"trial_id":"58916c494bf8712bb0d566f40efc807b7c6011ca2cbf8143b0ffe26b96a2786f"},{"attempt_index":8,"common_offset":0,"condition":"differential_rho90","config_sha256":"ac440fdc24af8dafd72c1beffe83dd3d65b2dfd3f34308f9d41d5d437fb15bf6","device_id":"w7-p000-d00","enrollment_id":"w7-p000-d00-enroll-v1","experiment_id":"week7-majority3-auth-correlated-v1","noise_identity":{"attempt_id":8,"device_id":"w7-p000-d00","master_seed":2026101207,"model_version":"puf-snn-correlated-noise-v1","noise_domain_id":"week7-majority3-auth-correlated-v1:differential_rho90","population_id":"w7-p000"},"policy_order":["single-read-v1","majority-3-v1"],"population_id":"w7-p000","reading_seed_sha256":["15c420012e1b35611b44fba9494a633ac06cb94c188a450aff89ebec07502d02","f2525d5244ef042a13c31790398717463205d59d2060faf98aa4094603afc9a5","bef03d9822f0017c835e6033410cde55dd531e3b316affddae1ced80d47ddd30"],"rho":0.9,"session_seed_sha256":"55df9a0884e5698d8d4fe8a74105425641fbc8eae11c3561375bea9967b423f0","sigma":0.1,"trial_id":"56cf7da5bdeec311b7bb165b84cfe1b4c7acd0e80b64024cb4dc9cfbee6da7c6"},{"attempt_index":6,"common_offset":0,"condition":"independent_stress","config_sha256":"ac440fdc24af8dafd72c1beffe83dd3d65b2dfd3f34308f9d41d5d437fb15bf6","device_id":"w7-p000-d00","enrollment_id":"w7-p000-d00-enroll-v1","experiment_id":"week7-majority3-auth-correlated-v1","noise_identity":{"attempt_id":6,"device_id":"w7-p000-d00","master_seed":2026101207,"model_version":"puf-snn-correlated-noise-v1","noise_domain_id":"week7-majority3-auth-correlated-v1:independent_stress","population_id":"w7-p000"},"policy_order":["single-read-v1","majority-3-v1"],"population_id":"w7-p000","reading_seed_sha256":["da9a6faf579b07361c5bdd690f467cf09cdebf3782b01ff49157539283007b92","a6d68dbd6f5ca712a707bcd768d4ba5fdd67430ff42057d1d9c7a3e13b62b3e6","6ceeea49aa8fdd4af1f2be85a333f459100b5707f0c604434e60ae09c2696405"],"rho":0.0,"session_seed_sha256":"cd9ab65e874838a05ced123c8ef80f0697f917ba488a234486fb534b1a899181","sigma":0.25,"trial_id":"8a95f59c06b3375eb7b52040329f0c9807c2534f6d2ea5fab2371387a5b1dc75"},{"attempt_index":9,"common_offset":0,"condition":"differential_rho90","config_sha256":"ac440fdc24af8dafd72c1beffe83dd3d65b2dfd3f34308f9d41d5d437fb15bf6","device_id":"w7-p000-d00","enrollment_id":"w7-p000-d00-enroll-v1","experiment_id":"week7-majority3-auth-correlated-v1","noise_identity":{"attempt_id":9,"device_id":"w7-p000-d00","master_seed":2026101207,"model_version":"puf-snn-correlated-noise-v1","noise_domain_id":"week7-majority3-auth-correlated-v1:differential_rho90","population_id":"w7-p000"},"policy_order":["majority-3-v1","single-read-v1"],"population_id":"w7-p000","reading_seed_sha256":["4e6e61293d3050783aa33b2b04af6a89757c4328187ef0ad829abf17dd377c15","528215c010dfa05e5faf3c3a973d3797d841a6a24b0942d1068cbde44cea81b4","b79d968319f2d08e7c1aed07c69077e46dc3627a0d498540cc05bfcdbe7877a5"],"rho":0.9,"session_seed_sha256":"6b713d6b63d98764042cc64ea1702b90cab583c5c5077809d4de293dde3c441e","sigma":0.1,"trial_id":"bef87cf1f3c2dbd4b2dac5b3824340cf18d9362da9b8486dbf730caf9b1f2373"},{"attempt_index":7,"common_offset":-1,"condition":"common_control","config_sha256":"ac440fdc24af8dafd72c1beffe83dd3d65b2dfd3f34308f9d41d5d437fb15bf6","device_id":"w7-p000-d00","enrollment_id":"w7-p000-d00-enroll-v1","experiment_id":"week7-majority3-auth-correlated-v1","noise_identity":{"attempt_id":7,"device_id":"w7-p000-d00","master_seed":2026101207,"model_version":"puf-snn-correlated-noise-v1","noise_domain_id":"week7-majority3-auth-correlated-v1:independent_nominal","population_id":"w7-p000"},"policy_order":["majority-3-v1","single-read-v1"],"population_id":"w7-p000","reading_seed_sha256":["f6056b686f0e7c6c01ff40804cf47ebcacc50869a32802d241ee503d8b9fdce7","b56c27e74501212cf086978971baf14aebf3eb4a913d7d03bcbebef35a59854f","d45647f279cfc26eb762c1b809ff54cdc4b8da1f7d12b3e97132af55dfbdbf0f"],"rho":0.0,"session_seed_sha256":"52d6ca1bc0f03bd86a8a2acf9a03d8ad5acc9d08d3378d0453c7daaded04ce88","sigma":0.1,"trial_id":"62357cf8dcace6c2a6390dc5dc9d9c9827f06a23862b4bfa4b9adee3e09fbbe6"},{"attempt_index":2,"common_offset":0,"condition":"independent_nominal","config_sha256":"ac440fdc24af8dafd72c1beffe83dd3d65b2dfd3f34308f9d41d5d437fb15bf6","device_id":"w7-p000-d00","enrollment_id":"w7-p000-d00-enroll-v1","experiment_id":"week7-majority3-auth-correlated-v1","noise_identity":{"attempt_id":2,"device_id":"w7-p000-d00","master_seed":2026101207,"model_version":"puf-snn-correlated-noise-v1","noise_domain_id":"week7-majority3-auth-correlated-v1:independent_nominal","population_id":"w7-p000"},"policy_order":["single-read-v1","majority-3-v1"],"population_id":"w7-p000","reading_seed_sha256":["6fc227762e5d85c67fb3a0842740848766421b606735e1ec5024b1c39de1855b","63c222372e1ff8dc9bef69f651b82abeac4b9de45d2d9a7f8cd49bc05845e17f","0cd0c93d66d839749f4da6a5f165cd06d33356302f298769b3c21dc59456dda8"],"rho":0.0,"session_seed_sha256":"c50a1e45127ad6da2553066c79978ebc4d34e22a10d5a580d16c6beac4ca397c","sigma":0.1,"trial_id":"b4b1f8f2bab7231f1d9bff3bae95e4d653e662a4c1c90294e3930668cd951437"},{"attempt_index":6,"common_offset":0,"conditi